{
 "entry": "film.js",
 "fps": 30,
 "frames": 36,
 "design": [
  1080,
  1920
 ],
 "shots": [
  {
   "id": "fall",
   "start": 0,
   "end": 36
  }
 ],
 "moments": {
  "land": 18
 },
 "proof": {
  "shot": "fall",
  "start": 0,
  "end": 36
 },
 "sound": {
  "narration": [],
  "sfx": [
   {
    "at": "land",
    "recipe": "thud",
    "gain_db": -4
   }
  ],
  "music": {
   "kind": "notes",
   "tempo": 120,
   "gain_db": -14,
   "tracks": [
    {
     "instrument": "pad",
     "notes": [
      [
       0,
       57,
       2.4,
       0.6
      ],
      [
       0,
       64,
       2.4,
       0.5
      ]
     ]
    },
    {
     "instrument": "marimba",
     "notes": [
      [
       1.2,
       69,
       0.5,
       0.7
      ]
     ]
    }
   ]
  }
 }
}
